<?xml version="1.0" encoding="UTF-8"?>
<pr xmlns:xsi="http://www.w3.org/2001/XMLSchema-instance"
 xsi:noNamespaceSchemaLocation="file:/Users/ceciliasoares/Documents/Universidade/4Ano/1semestre/DAW/DAW2020/TPC8/ProjectRecord.xsd">
    <meta>
        <key>Project Record</key>
        <title>Upload Multiple Files</title>
        <bdate>7 de Dezembro</bdate>
        <edate>7 de Dezembro</edate>
        <supervisor url="http://www.di.uminho.pt/~jcr"/>
        
    </meta>
    <team>
        <member id="a34900">
            <name>Cecília da Conceição de Oliveira Soares</name>
            <email>cecilia.oliveira.soares@gmail.com</email>
            <link url="https://github.com/soaresCecilia"/>
        </member>
    </team>
    <abstract>
        <p>O presente trabalho trabalho de casa tinha como objectivo executar o <i>upload</i> de múltiplos ficheiros.</p>
        <p>Para isso criamos a função <i>addFile<i>, que é chamada sempre que é pressionado o botão <b>Add File</p> e que 
        acrescenta ao formulário a parte de descrição do ficheiro e do carregamento do mesmo e inserimos essa informação 
        como o último filho do elemento em causa.<p>
        <p> Assim, é possível o utilizador escolha ficheiros de diferentes directorias, coisa que não é possível utilizando
        a opção <i>multiple<i> no formulário html quanod o <i>input</i> é um <i>file</i>.<p>       
    </abstract>
    <deliverables>
        <link url="https://github.com/soaresCecilia/DAW2020/blob/main/TPC8/servertpc.js"/>
        <link url="https://github.com/soaresCecilia/DAW2020/blob/main/TPC8/dbFiles.json"/>
        <link url="https://github.com/soaresCecilia/DAW2020/blob/main/TPC8/html-templates.js"/>
        <link url="https://github.com/soaresCecilia/DAW2020/blob/main/TPC8/public/imagens.js"/>      
    </deliverables>
</pr>
