<?xml version="1.0" encoding="UTF-8"?>
<pr xmlns:xsi="http://www.w3.org/2001/XMLSchema-instance"
 xsi:noNamespaceSchemaLocation="file:/Users/ceciliasoares/Documents/Universidade/4Ano/1semestre/DAW/DAW2020/TPC7/ProjectRecord.xsd">
    <meta>
        <key>Project Record</key>
        <title>Mongo e API Express</title>
        <bdate>30 de Novembro</bdate>
        <edate>30 de Novembro</edate>
        <supervisor url="http://www.di.uminho.pt/~jcr"/>
        
    </meta>
    <team>
        <member id="a34900">
            <name>Cecília da Conceição de Oliveira Soares</name>
            <email>cecilia.oliveira.soares@gmail.com</email>
            <link url="https://github.com/soaresCecilia"/>
        </member>
    </team>
    <abstract>
        <p>Com o presente trabalho criamos uma aplicação web que gere informação acerca dos alunos que 
        frequentam a disciplina de <i>Desenvolvimento de Aplicações Web</i>. Para isso, utilizamos a 
        <i>web application framework</i> <b>Express</b> que nos ajudou a criar uma <u>REST API</u> robusta e de forma rápida. </p>
        Além disso, exploramos ainda a base de dados <i>Mongo</i>, usando-a para guardar os dados dos alunos. </p>
        A presente aplicação permite-nos inserir, consultar, editar e remover os dados referente aos referidos alunos.</p>          
    </abstract>
    <deliverables>
        <link url="https://github.com/soaresCecilia/DAW2020/tree/main/TPC7/>
    </deliverables>
</pr>
